{
  "$schema": "https://json-schema.org/draft/2020-12/schema",
  "$id": "https://brik.dev/schemas/report/v1.1/aggregate.schema.json",
  "title": "Brik Pipeline Report Aggregate v1.1",
  "description": "Cross-stage aggregated pipeline report. v1.1 introduces pipeline.context (snapshot vs release) which drives the business filter, pipeline.business (overall outcome derived from per-stage business.status), and summary.business (counts of success / warning / error across stages). The legacy summary.warnings array is removed: warnings now live as business.status=warning on individual fragments.",
  "type": "object",
  "required": ["schema_version", "pipeline", "stages", "summary"],
  "additionalProperties": false,
  "properties": {
    "schema_version": {
      "description": "Aggregate schema version. Locked to '1.1'.",
      "type": "string",
      "const": "1.1"
    },
    "pipeline": {
      "description": "Pipeline-level metadata: identity, provenance, timing, overall status, and the v1.1 business outcome.",
      "type": "object",
      "required": ["id", "platform", "project", "started_at", "finished_at", "status", "context", "business"],
      "additionalProperties": false,
      "properties": {
        "id": {
          "description": "CI pipeline identifier (string for portability across platforms).",
          "type": "string"
        },
        "url": {
          "description": "Direct URL to the pipeline view, when the platform exposes one.",
          "type": "string"
        },
        "platform": {
          "description": "CI platform that ran the pipeline.",
          "type": "string",
          "enum": ["gitlab", "jenkins", "local", "github"]
        },
        "project": {
          "description": "Project name (from .project.name in brik.yml).",
          "type": "string"
        },
        "commit": {
          "description": "Git commit metadata. Optional; populated by init when available. Presence of commit.tag flips pipeline.context to 'release'.",
          "type": "object",
          "additionalProperties": false,
          "properties": {
            "sha": { "type": "string" },
            "short_sha": { "type": "string" },
            "ref": { "type": "string" },
            "branch": { "type": "string" },
            "tag": { "type": "string" },
            "author": { "type": "string" },
            "author_email": { "type": "string" },
            "timestamp": { "type": "string" },
            "message_subject": { "type": "string" },
            "repo_url": {
              "description": "Browseable HTTPS URL of the source repository, captured by init from CI_PROJECT_URL (GitLab), GIT_URL (Jenkins), or 'git config remote.origin.url' as a fallback. Credentials are stripped and SSH forms are converted to HTTPS. Used by the HTML renderer to build deep links to commits, branches and tags on the hosting forge (GitLab, GitHub, Gitea, Bitbucket).",
              "type": "string"
            }
          }
        },
        "started_at": {
          "description": "ISO-8601 timestamp with timezone offset, recorded at pipeline start.",
          "type": "string"
        },
        "finished_at": {
          "description": "ISO-8601 timestamp with timezone offset, recorded by report.aggregate_fragments or report.render.",
          "type": "string"
        },
        "duration_ms": {
          "description": "Pipeline wall-clock duration in milliseconds.",
          "type": "integer",
          "minimum": 0
        },
        "status": {
          "description": "Technical pipeline status: 'failed' if any fragment has status=failed, 'skipped' if all stages were skipped, 'success' otherwise. Read for technical analysis; see business.status for the user-facing verdict.",
          "type": "string",
          "enum": ["success", "failed", "skipped"]
        },
        "context": {
          "description": "Pipeline execution context. 'release' when the run carries a git tag (commit.tag non-null); 'snapshot' otherwise. Drives the business filter (snapshot is lenient, release is strict) and the continue_on_error default.",
          "type": "string",
          "enum": ["snapshot", "release"]
        },
        "business": {
          "description": "Pipeline-level business outcome, computed from per-stage business.status values. error if any stage is error; warning if any stage is warning and no error; success otherwise.",
          "type": "object",
          "required": ["status"],
          "additionalProperties": false,
          "properties": {
            "status": {
              "type": "string",
              "enum": ["success", "warning", "error"]
            }
          }
        },
        "triggered_by": {
          "description": "Origin of the pipeline run: a user identifier, 'push', 'schedule', 'manual', etc.",
          "type": "string"
        },
        "pipeline_source": {
          "description": "Trigger source surfaced by the platform wrapper (BRIK_PIPELINE_SOURCE), mirroring the wrapper-context enum. 'push' for branch/tag pushes on both GitLab and Jenkins; 'merge_request_event' for GitLab MR pipelines and Jenkins merge/pull-request builds (CHANGE_ID). Not derivable from context: push and merge_request_event both run as context=snapshot. Optional; absent on local runs without a platform wrapper.",
          "type": "string",
          "enum": ["push", "merge_request_event", "schedule", "web", "api"]
        },
        "notify": {
          "description": "Notification dispatch metadata, injected by stages.notify after the aggregate is built. Surfaces which channels were configured at run time, the policy each one used (BRIK_NOTIFY_*_ON), whether the policy matched this run, and the pipeline gatekeeper decision. Absent in pre-notify-v2 archives; renderers must treat it as optional.",
          "type": "object",
          "additionalProperties": false,
          "properties": {
            "channels": {
              "description": "Per-channel configuration snapshot. Order matches the dispatch order in stages.notify (slack, email, webhook).",
              "type": "array",
              "items": {
                "type": "object",
                "required": ["type", "configured", "on", "would_send"],
                "additionalProperties": false,
                "properties": {
                  "type": {
                    "description": "Channel kind.",
                    "type": "string",
                    "enum": ["slack", "email", "webhook"]
                  },
                  "configured": {
                    "description": "True when the channel trigger env var (BRIK_NOTIFY_SLACK_CHANNEL / BRIK_NOTIFY_EMAIL_TO / BRIK_NOTIFY_WEBHOOK_URL) is set at run time.",
                    "type": "boolean"
                  },
                  "on": {
                    "description": "Dispatch policy: BRIK_NOTIFY_*_ON. Defaults to 'always' when the channel is configured without an explicit policy.",
                    "type": "string"
                  },
                  "would_send": {
                    "description": "True when the channel was configured and the policy matched the pipeline outcome for this run, regardless of any delivery error. Captures intent, not delivery confirmation.",
                    "type": "boolean"
                  }
                }
              }
            },
            "gatekeeper": {
              "description": "Final pipeline outcome decision derived by stages.notify from pipeline.business.status. 'fail' when business_status is 'error'; 'pass' otherwise.",
              "type": "object",
              "required": ["decision", "business_status"],
              "additionalProperties": false,
              "properties": {
                "decision": {
                  "type": "string",
                  "enum": ["pass", "fail"]
                },
                "business_status": {
                  "type": "string",
                  "enum": ["success", "warning", "error"]
                }
              }
            }
          }
        }
      }
    },
    "stages": {
      "description": "Array of per-stage fragments, one per executed stage. Order matches CI stage order. Each item validates against the v1.1 fragment schema (carries the typed business block).",
      "type": "array",
      "items": {
        "$ref": "https://brik.dev/schemas/report/v1.1/fragment.schema.json"
      }
    },
    "summary": {
      "description": "Cross-stage aggregated metrics. v1.1 closes additionalProperties to lock the contract; new summary blocks require a schema bump. summary.warnings is removed (legacy form replaced by per-stage business.reason).",
      "type": "object",
      "required": ["stages", "business"],
      "additionalProperties": false,
      "properties": {
        "stages": {
          "description": "Stage outcome counts (technical axis).",
          "type": "object",
          "required": ["total", "passed", "failed", "skipped"],
          "additionalProperties": false,
          "properties": {
            "total":   { "type": "integer", "minimum": 0 },
            "passed":  { "type": "integer", "minimum": 0 },
            "failed":  { "type": "integer", "minimum": 0 },
            "skipped": { "type": "integer", "minimum": 0 }
          }
        },
        "business": {
          "description": "Stage outcome counts (business axis). Sums per-stage business.status values across the stages array.",
          "type": "object",
          "required": ["success_count", "warning_count", "error_count"],
          "additionalProperties": false,
          "properties": {
            "success_count": { "type": "integer", "minimum": 0 },
            "warning_count": { "type": "integer", "minimum": 0 },
            "error_count":   { "type": "integer", "minimum": 0 }
          }
        },
        "security": {
          "description": "Cross-stage security signal: critical findings per scanner and total vulnerabilities.",
          "type": "object",
          "additionalProperties": true,
          "properties": {
            "critical_findings": {
              "type": "object",
              "additionalProperties": true,
              "properties": {
                "sast":           { "type": "integer", "minimum": 0 },
                "scan_deps":      { "type": "integer", "minimum": 0 },
                "container_scan": { "type": "integer", "minimum": 0 }
              }
            },
            "total_vulnerabilities": { "type": "integer", "minimum": 0 }
          }
        },
        "test": {
          "description": "Test summary projected from the test fragment's business payload.",
          "type": "object",
          "additionalProperties": true,
          "properties": {
            "total":             { "type": "integer", "minimum": 0 },
            "passed":            { "type": "integer", "minimum": 0 },
            "failed":            { "type": "integer", "minimum": 0 },
            "skipped":           { "type": "integer", "minimum": 0 },
            "coverage_line_pct": { "type": "number" }
          }
        },
        "artifacts": {
          "description": "Build artefact summary projected from package and deploy fragments.",
          "type": "object",
          "additionalProperties": true,
          "properties": {
            "image":        { "type": "string" },
            "version":      { "type": "string" },
            "deployed_to":  { "type": "string" }
          }
        },
        "policy": {
          "description": "Findings management policy snapshot for this run.",
          "type": "object",
          "additionalProperties": true,
          "required": ["preset", "source"],
          "properties": {
            "preset": {
              "type": "string",
              "enum": ["pragmatic", "strict", "permissive"]
            },
            "source": {
              "type": "string",
              "enum": ["brik.yml", "org-policy"]
            },
            "org_policy_url": {
              "type": "string"
            },
            "org_policy_loaded_at": {
              "type": "string",
              "format": "date-time"
            },
            "expiring_soon": {
              "type": "array",
              "items": {
                "type": "object",
                "additionalProperties": true,
                "required": ["type", "expires"],
                "properties": {
                  "type":    { "type": "string", "enum": ["cve", "path"] },
                  "id":      { "type": "string" },
                  "glob":    { "type": "string" },
                  "expires": { "type": "string", "format": "date" },
                  "reason":  { "type": "string" }
                }
              }
            }
          }
        }
      }
    },
    "proof": {
      "description": "Optional proof envelope: hash of the report itself, links to retained artefacts, signature flag. v1.1 inherits the v1.0 contract; supply-chain signing remains a future concern.",
      "type": "object",
      "additionalProperties": false,
      "properties": {
        "report_sha256": { "type": "string" },
        "artifact_urls": {
          "type": "object",
          "additionalProperties": true,
          "properties": {
            "gitlab":  { "type": "string" },
            "jenkins": { "type": "string" }
          }
        },
        "signed": { "type": "boolean" }
      }
    }
  }
}
